<?xml version="1.0" encoding="ISO-8859-1"?>
<Maxx xmlns:xsi="http://www.w3.org/2001/XMLSchema-instance" xsi:noNamespaceSchemaLocation="KeyTest.xsd">
	<Processes>
		<Process>
			<Name>Main</Name>
		</Process>
		<Process>
			<Name>Sub</Name>
			<SubProcesses>
				<Process>
					<Name>Sub1</Name>
				</Process>
				<Process>
					<Name>Sub1</Name>
				</Process>
				<Process>
					<Name>Main</Name>
				</Process>
			</SubProcesses>
		</Process>
	</Processes>
</Maxx>